{
  "$schema": "./roadmap.schema.json",
  "schemaVersion": 1,
  "project": "AVA",
  "baselineVersion": "0.6.1",
  "baselineCompleted": [
    "content-v3-contract",
    "local-runtime-memory-fixture",
    "activity-engine-v3",
    "level1-development-slice",
    "payload-buildable-prototype",
    "audio-release-fail-closed-contract"
  ],
  "globalInvariants": [
    "محصول Android فقط Kotlin و Jetpack Compose در android/ است؛ src/ مرجع تاریخی است.",
    "اپ Android هرگز مستقیماً به Payload، PostgreSQL، S3 یا GraphQL متصل نمی‌شود.",
    "محتوا تا تأیید متخصص approvedForRelease=false می‌ماند و اثربخشی آموزشی ادعا نمی‌شود.",
    "صدای انسانی فقط پس از inspection، بازبینی فنی، بازبینی آموزشی و delivery آماده قابل انتشار است.",
    "TTS فارسی آفلاین fallback اختیاری است و هر فعالیت شنیداری writtenFallback دارد.",
    "شناسه‌های محتوا پایدارند؛ تغییر یا حذف ID موجود بدون migration ممنوع است.",
    "UI فقط state/actions می‌گیرد؛ فایل، شبکه و repository از Composable خوانده نمی‌شوند.",
    "هر تغییر باید تست متناسب، PROGRESS_FA و NATIVE_VERIFICATION واقعی داشته باشد.",
    "شکست محیط یا گیت هرگز به‌عنوان passed ثبت نمی‌شود.",
    "هیچ secret، credential، فایل صدای خام کودک یا داده شخصی وارد repository نمی‌شود."
  ],
  "forbiddenActions": [
    "ساخت APK یا AAB بدون درخواست صریح مالک",
    "اجرای Gradle assembleDebug/assembleRelease/bundleDebug/bundleRelease",
    "افزودن INTERNET یا RECORD_AUDIO permission پیش از ADR و مجوز صریح",
    "اتصال مستقیم Android به CMS یا object storage",
    "فعال‌کردن محتوای جدید بدون validator و review آموزشی",
    "دورزدن release gate با overrideAccess در endpoint عمومی",
    "ویرایش یا حذف تاریخچه برای سبزکردن مصنوعی شواهد",
    "جایگزینی AVA با branding، mascot، font یا صدای اختصاصی Duolingo"
  ],
  "phases": [
    {
      "id": "061",
      "titleFa": "بستن گیت‌های prototype",
      "playbook": "harness/phases/061_INTEGRATION_FA.md",
      "exitGate": [
        "PostgreSQL و MinIO واقعی بالا آمده و migration/bootstrap اجرا شده باشد.",
        "upload خصوصی و signed download با integration test اثبات شده باشد.",
        "تست‌های Native در toolchain کامل اجرا شده یا blocker دقیق ثبت شده باشد.",
        "بازبینی آموزشی/تلفظ به‌صورت human gate ثبت شده باشد."
      ],
      "tasks": [
        {
          "id": "061-db-s3-integration",
          "titleFa": "integration واقعی Payload با PostgreSQL و MinIO",
          "priority": "P0",
          "status": "ready",
          "automationAllowed": true,
          "dependsOn": [],
          "readFirst": ["AGENTS.md", "cms/payload/README_FA.md", "docs/adr/0003-cms-technology-spike-fa.md"],
          "allowedPaths": ["cms/payload/**", "scripts/**", "docs/**", "harness/**"],
          "acceptance": [
            "Compose services healthcheck سبز و migration بدون خطا باشد.",
            "کاربر نخست system_admin و کاربر دوم بدون مدیر قابل ساخت نباشد.",
            "upload master فقط در bucket خصوصی و prefix قرنطینه ذخیره شود.",
            "دسترسی ناشناس به فایل رد و signed download مجاز اثبات شود.",
            "integration test پس از restart نیز موفق باشد."
          ],
          "evidenceFiles": ["docs/PROGRESS_FA.md", "docs/NATIVE_VERIFICATION.json", "harness/WORKLOG.md"],
          "gates": [
            { "cwd": "cms/payload", "command": ["pnpm", "typecheck"] },
            { "cwd": "cms/payload", "command": ["pnpm", "test"] },
            { "cwd": ".", "command": ["python3", "scripts/validate-payload-prototype.py"] }
          ]
        },
        {
          "id": "061-native-toolchain",
          "titleFa": "اجرای ۱۰۴ تست Native و lint در toolchain کامل",
          "priority": "P0",
          "status": "ready",
          "automationAllowed": true,
          "dependsOn": [],
          "readFirst": ["AGENTS.md", "docs/TEST_STRATEGY_FA.md", "android/README.md"],
          "allowedPaths": ["android/**", "scripts/**", "docs/**", "harness/**"],
          "acceptance": [
            "Gradle 8.11.1، JDK 17 و Android SDK 35 شناسایی شوند.",
            "testDebugUnitTest و lintDebug بدون assemble/bundle اجرا شوند.",
            "تعداد تست اجراشده از گزارش واقعی استخراج شود.",
            "شکست شبکه یا SDK با command و stderr ثبت شود، نه passed."
          ],
          "evidenceFiles": ["docs/PROGRESS_FA.md", "docs/NATIVE_VERIFICATION.json", "harness/WORKLOG.md"],
          "gates": [
            { "cwd": "android", "command": ["./gradlew", "testDebugUnitTest", "lintDebug", "--no-daemon"] },
            { "cwd": ".", "command": ["python3", "scripts/audit-project.py"] }
          ]
        },
        {
          "id": "061-educator-review",
          "titleFa": "تأیید انسانی ترتیب، distractor، متن و تلفظ سطح ۱",
          "priority": "P0",
          "status": "human_gate",
          "automationAllowed": false,
          "dependsOn": [],
          "readFirst": ["docs/LEVEL1_SEQUENCE_FA.md", "docs/AUDIO_INVENTORY_FA.md"],
          "allowedPaths": ["design/**", "docs/**", "harness/**"],
          "acceptance": [
            "نام و صلاحیت بازبین، تاریخ و دامنه review ثبت شود.",
            "هر اصلاح با ID پایدار task/audio ثبت شود.",
            "هیچ عامل کدنویسی حق جعل یا خودکار اعلام‌کردن approval را ندارد."
          ],
          "evidenceFiles": ["docs/LEVEL1_SEQUENCE_FA.md", "docs/AUDIO_INVENTORY_FA.md", "harness/WORKLOG.md"],
          "gates": [
            { "cwd": ".", "command": ["python3", "scripts/validate-content-contract.py"] },
            { "cwd": ".", "command": ["python3", "scripts/validate-audio-inventory.py"] }
          ]
        }
      ]
    },
    {
      "id": "070",
      "titleFa": "CMS MVP و pipeline امن صدا",
      "playbook": "harness/phases/070_AUDIO_CMS_FA.md",
      "exitGate": [
        "master قرنطینه‌شده fail-closed اسکن و decode شود.",
        "delivery artifact قطعی تولید و با hash ثبت شود.",
        "دو reviewer مستقل و ناشر مستقل در integration test اثبات شوند.",
        "release آزمایشی فقط از delivery artifact صادر شود."
      ],
      "tasks": [
        {
          "id": "070-audio-inspection",
          "titleFa": "malware scan و decode واقعی master صوت",
          "priority": "P0",
          "status": "blocked",
          "automationAllowed": true,
          "dependsOn": ["061-db-s3-integration"],
          "readFirst": ["docs/adr/0002-audio-policy-and-workflow-fa.md", "cms/payload/README_FA.md"],
          "allowedPaths": ["cms/payload/**", "docs/**", "scripts/**", "harness/**"],
          "acceptance": [
            "ClamAV یا scanner قابل‌تعویض با timeout و fail-closed اجرا شود.",
            "ffprobe یا decoder واقعی duration، codec، channels و sample rate را استخراج کند.",
            "mismatch، فایل خراب، bomb و timeout به rejected/failed با error code امن برسند.",
            "log شامل secret، signed URL یا bytes فایل نباشد."
          ],
          "evidenceFiles": ["docs/PROGRESS_FA.md", "docs/NATIVE_VERIFICATION.json", "harness/WORKLOG.md"],
          "gates": [
            { "cwd": "cms/payload", "command": ["pnpm", "typecheck"] },
            { "cwd": "cms/payload", "command": ["pnpm", "test"] }
          ]
        },
        {
          "id": "070-audio-delivery-job",
          "titleFa": "job قطعی transcode و delivery metadata",
          "priority": "P0",
          "status": "blocked",
          "automationAllowed": true,
          "dependsOn": ["070-audio-inspection"],
          "readFirst": ["docs/AUDIO_INVENTORY_FA.md", "cms/payload/README_FA.md"],
          "allowedPaths": ["cms/payload/**", "docs/**", "scripts/**", "harness/**"],
          "acceptance": [
            "job idempotent و retry-safe باشد و یک master دو delivery متناقض نسازد.",
            "خروجی فقط codec/mime مجاز Android، حجم محدود و object key غیرقابل حدس داشته باشد.",
            "deliverySha256 و bytes پس از read-back verify ثبت شوند.",
            "release با pending/failed یا metadata ناقص مسدود بماند."
          ],
          "evidenceFiles": ["docs/PROGRESS_FA.md", "docs/NATIVE_VERIFICATION.json", "harness/WORKLOG.md"],
          "gates": [
            { "cwd": "cms/payload", "command": ["pnpm", "typecheck"] },
            { "cwd": "cms/payload", "command": ["pnpm", "test"] },
            { "cwd": ".", "command": ["python3", "scripts/validate-cms-contract.py"] }
          ]
        },
        {
          "id": "070-workflow-integration",
          "titleFa": "integration نقش‌ها، audit و release candidate",
          "priority": "P0",
          "status": "blocked",
          "automationAllowed": true,
          "dependsOn": ["070-audio-delivery-job", "061-educator-review"],
          "readFirst": ["design/cms.roles.json", "design/cms.export.schema.json", "docs/CMS_SPIKE_FA.md"],
          "allowedPaths": ["cms/payload/**", "design/**", "scripts/**", "docs/**", "harness/**"],
          "acceptance": [
            "author، reviewer فنی، reviewer آموزشی و publisher حساب‌های متفاوت باشند.",
            "تلاش self-approval و publish ناقص در API واقعی رد شود.",
            "audit create/update/review/publish قابل استخراج و در API غیرقابل ویرایش باشد.",
            "export تکراری byte-identical و منطبق با cms-export-v1 باشد."
          ],
          "evidenceFiles": ["docs/PROGRESS_FA.md", "docs/NATIVE_VERIFICATION.json", "harness/WORKLOG.md"],
          "gates": [
            { "cwd": "cms/payload", "command": ["pnpm", "test"] },
            { "cwd": ".", "command": ["python3", "scripts/validate-cms-contract.py"] },
            { "cwd": ".", "command": ["python3", "scripts/audit-project.py"] }
          ]
        }
      ]
    },
    {
      "id": "071",
      "titleFa": "همگام‌سازی offline-first",
      "playbook": "harness/phases/071_OFFLINE_SYNC_FA.md",
      "exitGate": [
        "active/previous/staging روی دیسک و پس از process death معتبر بمانند.",
        "download فقط پس از hash/signature/schema verify فعال شود.",
        "activation اتمیک و rollback خودکار در fault test اثبات شود.",
        "seed بدون شبکه همیشه قابل اجرا بماند."
      ],
      "tasks": [
        {
          "id": "071-disk-store",